<?xml version="1.0" encoding="UTF-8"?>
<!DOCTYPE theme PUBLIC "wa-app-theme" "http://www.webasyst.com/wa-content/xml/wa-app-theme.dtd" >
<theme id="topshop" system="0" vendor="898299" author="wa-magazin.ru" app="site" version="1.0" parent_theme_id="shop:topshop">
    <name locale="en_US">Themes TopShop for Site</name>
    <name locale="ru_RU">Тема «TopShop» для Сайт</name>
    <description locale="en_US">Adaptive design theme TopShop</description>
    <description locale="ru_RU">Адаптивная тема «TopShop»</description>
    <files>
        <file path="index.html" parent="1">
            <description locale="en_US">Common layout</description>
            <description locale="ru_RU">Основной макет</description>
        </file>
        <file path="head.html">
            <description locale="en_US">Head file</description>
            <description locale="ru_RU">Файл для вставки в head</description>
        </file>
        <file path="breadcrumb.html">
            <description locale="en_US">Breadcrumbs</description>
            <description locale="ru_RU">Хлебные крошки</description>
        </file>
        <file path="page.html">
            <description locale="en_US">Page content</description>
            <description locale="ru_RU">Содержимое страницы</description>
        </file>
        <file path="footer.html" parent="1">
            <description locale="en_US">App specific footer content</description>
            <description locale="ru_RU">Содержимое футера приложения</description>
        </file>
        <file path="my.profile.html" parent="1">
            <description locale="en_US">Customer account interface: contact info editing form</description>
            <description locale="ru_RU">Личный кабинет покупателя: редактирование контактной информации</description>
        </file>
        <file path="login.html" parent="1">
            <description locale="en_US">Login page</description>
            <description locale="ru_RU">Страница входа для пользователей</description>
        </file>
        <file path="forgotpassword.html" parent="1">
            <description locale="en_US">Forgot password page</description>
            <description locale="ru_RU">Страница сброса пароля</description>
        </file>
        <file path="signup.html" parent="1">
            <description locale="en_US">Sign up page</description>
            <description locale="ru_RU">Страница регистрации пользователей</description>
        </file>
        <file path="main.html">
            <description locale="en_US">Content page</description>
            <description locale="ru_RU">Главная страница для вывода контетна</description>
        </file>
        <file path="error.html">
            <description locale="en_US">404 and other errors</description>
            <description locale="ru_RU">404 и другие ошибки</description>
        </file>
    </files>
    <about locale="en_US"></about>
    <about locale="ru_RU">Универсальное семейство тем дизайна "TopShop" для базовых приложений фреймворка Вебасист:
        Сайт, Блог, Фото, Shop-Script и других. Темы дизайна "TopShop" оптимизированы для всех современных браузеров,
        планшетных компьютеров и мобильных устройств на основе iOS и Android.
    </about>
    <locales>
        <locale>
            <msgid>Tags</msgid>
            <msgstr locale="ru_RU">Теги</msgstr>
        </locale>
    </locales>
</theme>