<?xml version="1.0" encoding="UTF-8"?>
<!DOCTYPE theme PUBLIC "wa-app-theme" "http://www.webasyst.com/wa-content/xml/wa-app-theme.dtd">
<theme id="mmtt" system="0" vendor="bd9" author="Vadim" app="site" version="1.1.1">
  <name locale="en_US">1mmtt.ru</name>
  <name locale="ru_RU">1mmtt.ru</name>
  <description locale="ru_RU">no</description>
  <files>
    <file path="index.html" custom="0">
    </file>
      <file path="header.html" custom="0">
      </file>
    </files>
  <about locale="en_US">
<![CDATA[
]]>
  </about>
  <about locale="ru_RU">
<![CDATA[
]]>
  </about>
</theme>
