<?xml version="1.0" encoding="UTF-8"?>
<!DOCTYPE theme PUBLIC "wa-app-theme" "http://www.webasyst.com/wa-content/xml/wa-app-theme.dtd">
<theme id="dsv2" system="1" vendor="988467" author="Designsovkusom" app="mailer" parent_theme_id="site:dsv2" version="2.5.0">
    <name locale="en_US">Design with taste 2</name>
    <name locale="ru_RU">Дизайн со вкусом 2</name>
    <files>
        <file path="my.subscriptions.html">
            <description locale="en_US">Subscriptions home page</description>
            <description locale="ru_RU">Начальная страница подписок</description>
        </file>
        <file path="my.nav.html">
            <description locale="en_US">Customer portal interface: сommon navigation elements</description>
            <description locale="ru_RU">Личный кабинет клиента: общие элементы навигации</description>
        </file>
        <file path="searchform.html" custom="0">
            <description locale="en_US">Search form</description>
            <description locale="ru_RU">Форма поиска</description>
        </file>
        <file path="head.html" custom="0">
            <description locale="en_US">Mailer app's &lt;head&gt; instructions</description>
            <description locale="ru_RU">Блок &lt;head&gt; приложения «Рассылки»</description>
        </file>
        <file path="js.html" custom="0">
            <description locale="en_US">JS files (mailer)</description>
            <description locale="ru_RU">JS файлы (рассылки)</description>
        </file>
        <file path="index.html" custom="0" parent="1"></file>
        <file path="error.html" custom="0" parent="1"></file>
    </files>
</theme>
