<?xml version="1.0" encoding="UTF-8"?>
<!DOCTYPE theme PUBLIC "wa-app-theme" "http://www.webasyst.com/wa-content/xml/wa-app-theme.dtd">
<theme id="dsv2" system="0" vendor="988467" author="Designsovkusom" app="blog" parent_theme_id="site:dsv2" version="2.5.0">
  <name locale="en_US">Design with taste 2</name>
  <name locale="ru_RU">Дизайн со вкусом 2</name>
  <files>
    <file path="index.html" custom="0" parent="1">
        </file>
    <file path="main.html" custom="0">
      <description locale="en_US">Main layout and navigation for the Blog app content</description>
      <description locale="ru_RU">Основное макет вывода содержимого и навигации в приложении «Блог»</description>
    </file>
    <file path="head.html" custom="0">
      <description locale="en_US">Blog app's &lt;head&gt; instructions</description>
      <description locale="en_US">Блок &lt;head&gt; приложения «Блог»</description>
    </file>
    <file path="js.html" custom="0">
      <description locale="en_US">JS files (blog)</description>
      <description locale="ru_RU">JS файлы (блог)</description>
    </file>
    <file path="sidebar.html" custom="0">
      <description locale="en_US">Sidebar (Blog)</description>
      <description locale="ru_RU">Боковая панель (Блог)</description>
    </file>
    <file path="stream.html" custom="0">
      <description locale="en_US">Post stream wrapper</description>
      <description locale="ru_RU">Обертка для страницы вывода списка записей</description>
    </file>
    <file path="stream_search.html" custom="0">
      <description locale="en_US">Post search (filtering) results, e.g. custom search, by tag, by author</description>
      <description locale="ru_RU">Результат поиска (фильтрации) записей, например, по тегу или автору</description>
    </file>
    <file path="stream_posts.html" custom="0">
      <description locale="en_US">Default post list view mode</description>
      <description locale="ru_RU"/>
    </file>
    <file path="post.html" custom="0">
      <description locale="en_US">Dedicated post page</description>
      <description locale="ru_RU">Страница одной записи блога</description>
    </file>
    <file path="page.html" custom="0">
      <description locale="en_US">Static info page</description>
      <description locale="ru_RU">Информационная страница</description>
    </file>
    <file path="comments.html" custom="0">
      <description locale="en_US">Post comment list</description>
      <description locale="ru_RU">Комментарии к записи блога</description>
    </file>
    <file path="comment.html" custom="0">
      <description locale="en_US">One comment template</description>
      <description locale="ru_RU">Вывод одного комментария из списка</description>
    </file>
    <file path="footer.html" custom="0">
      <description locale="en_US">App specific footer content</description>
      <description locale="ru_RU">Содержимое футера приложения</description>
    </file>
    <file path="blog.js" custom="0">
      <description locale="en_US">JS</description>
      <description locale="ru_RU">JS</description>
    </file>
    <file path="dsv.blog.css" custom="0">
      <description locale="ru_RU">CSS стили приложения «Блог»</description>
    </file>
    <file path="post.album.html">
      <description locale="en_US">Photo album attached to the blog post</description>
      <description locale="ru_RU">Фотоальбом, прикрепленный к записи в блоге</description>
    </file>
    <file path="menu.app.html" custom="0">
      <description locale="en_US">Blog application menu</description>
      <description locale="ru_RU">Меню приложения Блог</description>
    </file>
    <file path="searchform.html" custom="0">
      <description locale="en_US">Search form</description>
      <description locale="ru_RU">Форма поиска</description>
    </file>
    <file path="dsv.css" custom="0" parent="1">
      <description locale="ru_RU">Базовый набор стилей «Дизайн со вкусом 2»</description>
    </file>
    <file path="bootstrap.min.css" custom="0" parent="1">
      <description locale="ru_RU">Bootstrap v3.2.0</description>
    </file>
    <file path="dsv.css" custom="0" parent="1">
      <description locale="ru_RU">Базовый набор стилей «Дизайн со вкусом 2»</description>
      <description locale="ru_RU">Base styles «Design with taste 2»</description>
    </file>
    <file path="dsv.min.css" custom="0" parent="1">
      <description locale="ru_RU">Базовый набор стилей (минимизированный)</description>
      <description locale="ru_RU">Base styles «Design with taste 2» (compressed)</description>
    </file>
    <file path="font-awesome.min.css" custom="0" parent="1">
      <description locale="ru_RU">Font Awesome 4.3.0</description>
    </file>
    <file path="dsv.js" custom="0" parent="1">
      <description locale="ru_RU">Основной js файл</description>
    </file>
    <file path="login.html" parent="1"/>
    <file path="signup.html" parent="1"/>
    <file path="forgotpassword.html" parent="1"/>
    <file path="my.profile.html" parent="1"/>
    <file path="error.html" parent="1"/>
  </files>
  <about locale="en_US">
&lt;p&gt;&lt;b&gt; «Design with taste» &lt;/b&gt; - is a universal family of those designs for all base application framework WebAsyst: Website, Blog, Photography, Shop-Script and others. Parent (main) theme of family, which includes a basic set of CSS-styles and the overall layout design index.html, is the theme for the application «Design with taste» "Site" (this issue). All themes «Design with taste» design for other applications (Blog, Photo and others) use the base CSS and index.html from the parent (main) theme. &lt;/ p&gt;
&lt;p&gt;&lt;b&gt; «Design with taste» &lt;/b&gt; also adapted and optimized for mobile devices (Pads and Smartphones). Topic is based on Bootstrap 3, which provide correct display on all modern browsers.&lt;/p&gt;

    </about>
  <about locale="ru_RU">
&lt;p&gt;&lt;b&gt; «Дизайн со вкусом» &lt;/b&gt; - это универсальное семейство адаптивных тем дизайна для всех базовых приложений фреймворка Вебасист: Сайт, Блог, Фото, Shop-Script и других. Родительской (основной) темой семейства, включающей в себя базовый набор CSS-стилей и общий макет дизайна index.html, является тема «Дизайн со вкусом» для приложения «Сайт». Все темы дизайна шаблона других приложений (Блог, Фото, Магазин и других) используют базовый CSS и index.html из родительской (основной) темы. &lt;/p&gt;
&lt;p&gt;&lt;b&gt; «Дизайн со вкусом» &lt;/b&gt; также адаптирован и оптимизирован для мобильных устройств (планшеты и смартфоны). Тема дизайна разработана на основе Bootstrap 3, что обеспечивает корректное отображение на всех современных браузерах. &lt;/p&gt;

    </about>
  <settings>
    <setting var="divider_blog" control_type="group_divider">
      <value/>
      <name locale="en_US">3.0. Sidebar (Blog)</name>
      <name locale="ru_RU">3.0. Боковая панель (Блог)</name>
    </setting>
    <setting var="divider_sidebar_blog" control_type="group_divider">
      <value/>
      <name locale="en_US">3.1. Sidebar (Blog)</name>
      <name locale="ru_RU">3.1. Боковая панель (Блог)</name>
    </setting>
    <setting var="sidebar_blog_home" control_type="checkbox">
      <value>1</value>
      <name locale="en_US">Homepage</name>
      <name locale="ru_RU">Главная страница</name>
    </setting>
    <setting var="sidebar_blog_post" control_type="checkbox">
      <value>1</value>
      <name locale="en_US">Post page</name>
      <name locale="ru_RU">Страница поста</name>
    </setting>
  </settings>
</theme>
