<?xml version="1.0" encoding="UTF-8"?>
<!DOCTYPE theme PUBLIC "wa-app-theme" "http://www.webasyst.com/wa-content/xml/wa-app-theme.dtd">
<theme id="mmtt" system="0" vendor="bd9" author="Vadim" app="blog" parent_theme_id="site:mmtt" version="1.1.0">
    <name locale="en_US">mmtt</name>
    <name locale="ru_RU">mmtt</name>
    <files>
        <file path="index.html" custom="0" parent="1">
        </file>
        <file path="header.html" custom="0" parent="1">
        </file>
    </files>
    <about locale="en_US">
<![CDATA[
]]>
    </about>
    <about locale="ru_RU">
<![CDATA[
]]>
    </about>    
</theme>
